transaction_id,transaction_date,amount,transaction_type,merchant_name,category,account_type,location,currency,description
604,3/29/2022,7592.07,withdrawal,Photofeed,utilities,credit card,Blantyre,MWK,sapien non mi integer ac neque duis bibendum morbi non quam nec dui luctus rutrum nulla tellus
605,3/20/2022,8805.91,deposit,Kwideo,transportation,credit card,Brataj,ALL,pretium iaculis justo in hac habitasse platea dictumst etiam faucibus cursus urna ut tellus nulla ut
606,3/14/2022,4611.29,deposit,Thoughtblab,groceries,checking,Ithari,NPR,amet sem fusce consequat nulla nisl nunc nisl duis bibendum felis sed interdum venenatis turpis enim blandit mi in
607,3/28/2022,7994.94,deposit,Zoonoodle,entertainment,checking,Shuren,CNY,justo aliquam quis turpis eget elit sodales scelerisque mauris sit amet eros suspendisse
608,3/1/2022,7330.19,withdrawal,Blogtags,utilities,savings,Sūrāb,PKR,diam id ornare imperdiet sapien urna pretium nisl ut volutpat
609,3/27/2022,113.49,withdrawal,Realcube,groceries,checking,Fortuna,CRC,hac habitasse platea dictumst etiam faucibus cursus urna ut tellus nulla ut erat
610,3/19/2022,5116.65,transfer,Divape,transportation,credit card,Taramana,IDR,ultrices libero non mattis pulvinar nulla pede ullamcorper augue a suscipit nulla elit ac nulla sed vel enim sit
611,3/18/2022,4106.65,withdrawal,Dabjam,entertainment,credit card,Sobreira,EUR,nullam varius nulla facilisi cras non velit nec nisi vulputate nonummy maecenas
612,3/24/2022,5008.98,transfer,Riffwire,entertainment,checking,Puzi,CNY,luctus et ultrices posuere cubilia curae duis faucibus accumsan odio curabitur convallis duis consequat
613,3/14/2022,7053.94,transfer,Photobug,groceries,checking,Bairan,PHP,erat quisque erat eros viverra eget congue eget semper rutrum
614,3/21/2022,6599.78,withdrawal,Gigazoom,entertainment,credit card,Parung,IDR,semper rutrum nulla nunc purus phasellus in felis donec semper sapien a libero nam dui proin leo odio porttitor id
615,3/11/2022,5737.82,deposit,Riffpedia,entertainment,savings,Santa Rita Aplaya,PHP,eleifend donec ut dolor morbi vel lectus in quam fringilla rhoncus mauris enim leo
616,3/18/2022,7469.06,transfer,Yakijo,transportation,checking,Gigant,RUB,in eleifend quam a odio in hac habitasse platea dictumst maecenas ut massa quis augue luctus tincidunt nulla mollis molestie
617,3/28/2022,2129.73,withdrawal,Dazzlesphere,utilities,checking,Potok Złoty,PLN,platea dictumst maecenas ut massa quis augue luctus tincidunt nulla mollis molestie
618,3/25/2022,2536.36,deposit,Avaveo,groceries,checking,Wangzuizi,CNY,luctus et ultrices posuere cubilia curae mauris viverra diam vitae quam suspendisse potenti
619,3/23/2022,5459.29,transfer,Innojam,groceries,savings,Nozdrzec,PLN,nec euismod scelerisque quam turpis adipiscing lorem vitae mattis nibh ligula nec sem duis aliquam convallis nunc proin at
620,3/30/2022,4637.13,withdrawal,Einti,transportation,checking,Xiongji,CNY,velit eu est congue elementum in hac habitasse platea dictumst morbi
621,3/14/2022,4062.51,deposit,Aimbu,entertainment,savings,Enschede,EUR,sem duis aliquam convallis nunc proin at turpis a pede posuere nonummy integer non velit donec diam neque vestibulum
622,3/5/2022,6821.12,deposit,Dabshots,utilities,credit card,Sempu,IDR,dolor morbi vel lectus in quam fringilla rhoncus mauris enim
623,3/29/2022,2383.7,deposit,Livetube,utilities,savings,Arrap’i,AMD,maecenas ut massa quis augue luctus tincidunt nulla mollis molestie lorem quisque ut erat curabitur gravida nisi at nibh in
624,3/13/2022,7123.08,transfer,Midel,utilities,savings,Fraile Pintado,ARS,sapien cum sociis natoque penatibus et magnis dis parturient montes nascetur
625,3/13/2022,4812.02,transfer,Aivee,entertainment,savings,Koronganayam,IDR,ante vel ipsum praesent blandit lacinia erat vestibulum sed magna at
626,3/17/2022,5998.08,withdrawal,Thoughtmix,entertainment,savings,Kitāf,YER,pellentesque ultrices phasellus id sapien in sapien iaculis congue vivamus metus
627,3/13/2022,4083.18,withdrawal,Fivebridge,groceries,credit card,Zhongxi,CNY,ligula sit amet eleifend pede libero quis orci nullam molestie nibh in lectus pellentesque at nulla suspendisse
628,3/12/2022,4045.59,transfer,Gabtune,groceries,checking,Plavsk,RUB,in quis justo maecenas rhoncus aliquam lacus morbi quis tortor id nulla
629,3/7/2022,4116.92,deposit,Gabspot,groceries,savings,Windsor,CAD,luctus et ultrices posuere cubilia curae nulla dapibus dolor vel est
630,3/3/2022,9597.48,deposit,Skinder,groceries,savings,Brody,PLN,et ultrices posuere cubilia curae duis faucibus accumsan odio curabitur convallis duis consequat dui nec nisi
631,3/11/2022,2734.89,deposit,Shuffletag,utilities,credit card,Daşoguz,TMT,mauris lacinia sapien quis libero nullam sit amet turpis elementum ligula vehicula
632,3/9/2022,8950.96,transfer,Youbridge,entertainment,checking,La Guacamaya,HNL,consequat dui nec nisi volutpat eleifend donec ut dolor morbi vel lectus in quam fringilla rhoncus
633,3/1/2022,1105.0,deposit,Roomm,transportation,checking,Kālīganj,BDT,hac habitasse platea dictumst maecenas ut massa quis augue luctus tincidunt nulla mollis molestie lorem
634,3/20/2022,1003.77,transfer,Brainverse,groceries,credit card,Baranoa,COP,hac habitasse platea dictumst maecenas ut massa quis augue luctus tincidunt nulla
635,3/27/2022,344.89,transfer,Youspan,transportation,savings,Martinópolis,BRL,ipsum primis in faucibus orci luctus et ultrices posuere cubilia curae duis faucibus accumsan
636,3/19/2022,503.85,withdrawal,Flashpoint,utilities,checking,Ağdam,AZN,pulvinar nulla pede ullamcorper augue a suscipit nulla elit ac
637,3/20/2022,814.4,transfer,Voonix,utilities,credit card,Vyksa,RUB,in felis eu sapien cursus vestibulum proin eu mi nulla ac enim in tempor turpis nec euismod scelerisque quam
638,3/11/2022,1062.29,transfer,Plajo,transportation,savings,Tunal,PEN,neque vestibulum eget vulputate ut ultrices vel augue vestibulum ante ipsum primis
639,3/24/2022,5256.13,withdrawal,Voolith,transportation,checking,Cikembang,IDR,sapien urna pretium nisl ut volutpat sapien arcu sed augue aliquam erat volutpat
640,3/1/2022,5254.73,transfer,Dynava,transportation,credit card,Paris La Défense,EUR,donec semper sapien a libero nam dui proin leo odio porttitor id consequat in consequat ut nulla sed accumsan felis
641,3/5/2022,1088.79,transfer,Jabbersphere,groceries,checking,Neftçala,AZN,dolor vel est donec odio justo sollicitudin ut suscipit a feugiat et eros vestibulum ac est lacinia nisi venenatis
642,3/19/2022,568.92,transfer,Myworks,entertainment,savings,Sukaraja,IDR,erat vestibulum sed magna at nunc commodo placerat praesent blandit nam nulla integer pede justo lacinia eget tincidunt eget
643,3/30/2022,5093.07,transfer,Omba,utilities,savings,Kurbnesh,ALL,fusce consequat nulla nisl nunc nisl duis bibendum felis sed interdum venenatis turpis enim
644,3/19/2022,6933.95,transfer,Mita,transportation,savings,Ocampo,PHP,integer tincidunt ante vel ipsum praesent blandit lacinia erat vestibulum sed magna at nunc commodo
645,3/16/2022,7785.12,deposit,Dabfeed,utilities,checking,Guanqiao,CNY,eros viverra eget congue eget semper rutrum nulla nunc purus phasellus in felis donec semper sapien a libero nam
646,3/14/2022,3692.07,transfer,Demivee,transportation,checking,Aulnay-sous-Bois,EUR,nonummy integer non velit donec diam neque vestibulum eget vulputate ut
647,3/23/2022,5488.74,deposit,Vitz,entertainment,savings,Sindangpanji,IDR,ligula sit amet eleifend pede libero quis orci nullam molestie nibh in lectus pellentesque at
648,3/21/2022,6603.41,deposit,Camimbo,groceries,checking,Thị Trấn Nga Sơn,VND,posuere nonummy integer non velit donec diam neque vestibulum eget vulputate ut ultrices vel augue vestibulum ante ipsum primis in
649,3/8/2022,7884.29,withdrawal,Meeveo,entertainment,credit card,Nanjie,CNY,mattis nibh ligula nec sem duis aliquam convallis nunc proin at turpis a pede posuere nonummy
650,3/9/2022,2973.41,withdrawal,Yodoo,entertainment,credit card,Anserma,COP,ut nunc vestibulum ante ipsum primis in faucibus orci luctus et ultrices posuere cubilia curae mauris
651,3/6/2022,465.91,withdrawal,Skyvu,transportation,checking,Tsementnozavodskiy,RUB,mauris lacinia sapien quis libero nullam sit amet turpis elementum ligula vehicula consequat morbi a ipsum integer a nibh
652,3/16/2022,3334.39,deposit,Agimba,transportation,savings,Jiangbei,CNY,sed magna at nunc commodo placerat praesent blandit nam nulla integer pede justo lacinia
653,3/28/2022,6478.63,withdrawal,Avamm,groceries,credit card,Fort Wayne,USD,sapien quis libero nullam sit amet turpis elementum ligula vehicula consequat morbi a ipsum integer
654,3/30/2022,3934.95,withdrawal,Thoughtbridge,entertainment,credit card,Asan,KRW,mus vivamus vestibulum sagittis sapien cum sociis natoque penatibus et magnis
655,3/25/2022,3734.59,withdrawal,Eidel,entertainment,checking,Hostomice,CZK,vel sem sed sagittis nam congue risus semper porta volutpat quam pede lobortis
656,3/5/2022,2799.91,deposit,Flashdog,utilities,checking,Rocky Mountain House,CAD,proin interdum mauris non ligula pellentesque ultrices phasellus id sapien in sapien iaculis
657,3/10/2022,8314.79,deposit,Jabberstorm,utilities,credit card,Jeponkrajan,IDR,odio odio elementum eu interdum eu tincidunt in leo maecenas pulvinar lobortis est phasellus sit amet erat nulla tempus
658,3/11/2022,9560.79,transfer,Topiclounge,utilities,credit card,Hacıqabul,AZN,ultricies eu nibh quisque id justo sit amet sapien dignissim vestibulum vestibulum ante
659,3/25/2022,5992.11,deposit,Youspan,groceries,checking,Uspenskoye,RUB,in hac habitasse platea dictumst etiam faucibus cursus urna ut
660,3/27/2022,6586.44,deposit,Oyoyo,groceries,savings,Vladislav,CZK,quam sollicitudin vitae consectetuer eget rutrum at lorem integer tincidunt
661,3/20/2022,474.59,deposit,Dabshots,utilities,savings,Nageswari,BDT,libero nullam sit amet turpis elementum ligula vehicula consequat morbi a ipsum
662,3/23/2022,8040.84,deposit,Blogtags,transportation,checking,Tánh Linh,VND,sagittis nam congue risus semper porta volutpat quam pede lobortis ligula sit amet eleifend pede libero quis orci
663,3/24/2022,1065.64,deposit,Vinte,transportation,savings,Phôngsali,LAK,pede ullamcorper augue a suscipit nulla elit ac nulla sed vel enim
664,3/24/2022,8040.1,transfer,Photospace,transportation,credit card,Stockholm,SEK,nullam molestie nibh in lectus pellentesque at nulla suspendisse potenti cras in purus eu magna vulputate luctus cum
665,3/28/2022,9433.36,deposit,Gabtune,entertainment,savings,Bagani,NAD,vel pede morbi porttitor lorem id ligula suspendisse ornare consequat lectus
666,3/8/2022,8349.98,deposit,Trudeo,groceries,checking,Maogou,CNY,pede ullamcorper augue a suscipit nulla elit ac nulla sed vel enim sit amet nunc viverra dapibus nulla
667,3/4/2022,9151.01,transfer,Skippad,utilities,savings,Ballivor,EUR,proin interdum mauris non ligula pellentesque ultrices phasellus id sapien in sapien iaculis congue vivamus metus
668,3/12/2022,3842.33,transfer,Youspan,entertainment,savings,Xiapu,CNY,non mi integer ac neque duis bibendum morbi non quam nec dui
669,3/1/2022,5970.0,deposit,Vimbo,entertainment,savings,Muarapinang,IDR,dis parturient montes nascetur ridiculus mus vivamus vestibulum sagittis sapien cum sociis natoque
670,3/9/2022,2076.26,transfer,Jayo,transportation,checking,Hikari,JPY,dui proin leo odio porttitor id consequat in consequat ut nulla sed accumsan felis ut at dolor quis odio consequat
671,3/27/2022,2922.51,deposit,Fanoodle,transportation,savings,Vithkuq,ALL,lectus aliquam sit amet diam in magna bibendum imperdiet nullam orci pede venenatis non sodales sed tincidunt eu felis
672,3/16/2022,3324.83,withdrawal,Ailane,utilities,checking,Hekou,CNY,ut tellus nulla ut erat id mauris vulputate elementum nullam varius
673,3/2/2022,9609.21,transfer,Feedfish,groceries,savings,Matsubase,JPY,sollicitudin ut suscipit a feugiat et eros vestibulum ac est lacinia nisi venenatis
674,3/12/2022,757.94,deposit,Quinu,utilities,credit card,Enonkoski,EUR,dui luctus rutrum nulla tellus in sagittis dui vel nisl duis ac nibh fusce lacus
675,3/5/2022,1918.67,withdrawal,Skyndu,utilities,checking,Replot,EUR,libero nam dui proin leo odio porttitor id consequat in consequat ut nulla sed
676,3/23/2022,1157.57,deposit,Kanoodle,utilities,credit card,Geser,IDR,justo lacinia eget tincidunt eget tempus vel pede morbi porttitor lorem id ligula suspendisse ornare consequat lectus in est
677,3/4/2022,2869.29,withdrawal,Jabberbean,utilities,checking,Aral,KZT,quam a odio in hac habitasse platea dictumst maecenas ut massa quis augue luctus tincidunt nulla mollis molestie
678,3/15/2022,7199.68,withdrawal,Flipstorm,utilities,savings,Kupiskis,LTL,cum sociis natoque penatibus et magnis dis parturient montes nascetur ridiculus
679,3/26/2022,1666.11,transfer,Gigashots,transportation,checking,Karagach,RUB,suspendisse ornare consequat lectus in est risus auctor sed tristique in tempus sit amet sem fusce consequat
680,3/10/2022,69.74,transfer,Dynava,utilities,savings,Gunungangka,IDR,id mauris vulputate elementum nullam varius nulla facilisi cras non velit nec nisi vulputate nonummy maecenas
681,3/10/2022,5713.81,withdrawal,Yakijo,transportation,credit card,Ferbane,EUR,arcu sed augue aliquam erat volutpat in congue etiam justo etiam pretium iaculis justo in hac habitasse platea
682,3/30/2022,1274.64,withdrawal,Topiclounge,transportation,checking,Jatinagara Kulon,IDR,rutrum rutrum neque aenean auctor gravida sem praesent id massa id
683,3/22/2022,9750.94,deposit,Mydeo,utilities,credit card,Anuchino,RUB,quam turpis adipiscing lorem vitae mattis nibh ligula nec sem duis aliquam convallis nunc proin at turpis
684,3/24/2022,9039.12,transfer,Mita,transportation,checking,Tyoply Stan,RUB,faucibus orci luctus et ultrices posuere cubilia curae nulla dapibus dolor vel est donec odio justo
685,3/24/2022,9743.24,deposit,Agimba,groceries,checking,Cortez,PHP,felis eu sapien cursus vestibulum proin eu mi nulla ac enim in tempor turpis nec euismod scelerisque quam turpis
686,3/3/2022,3800.16,withdrawal,Voolia,utilities,savings,Hengfan,CNY,ipsum primis in faucibus orci luctus et ultrices posuere cubilia curae nulla dapibus dolor vel est donec odio justo
687,3/23/2022,6733.41,deposit,Tagfeed,transportation,checking,Siedlce,PLN,luctus tincidunt nulla mollis molestie lorem quisque ut erat curabitur gravida nisi at nibh in hac habitasse platea dictumst aliquam
688,3/23/2022,230.49,withdrawal,Yacero,utilities,credit card,Longgang,CNY,felis donec semper sapien a libero nam dui proin leo odio porttitor
689,3/27/2022,8198.48,deposit,Shufflester,entertainment,credit card,Reno,USD,rhoncus sed vestibulum sit amet cursus id turpis integer aliquet massa id lobortis convallis tortor risus dapibus augue vel
690,3/16/2022,1590.91,withdrawal,Kwinu,entertainment,credit card,Okulovka,RUB,nulla tellus in sagittis dui vel nisl duis ac nibh fusce lacus purus aliquet at feugiat non
691,3/30/2022,3379.33,deposit,Reallinks,transportation,checking,Cercal,EUR,vel ipsum praesent blandit lacinia erat vestibulum sed magna at nunc commodo
692,3/15/2022,4049.74,transfer,Flipstorm,transportation,savings,Sendai-shi,JPY,cras mi pede malesuada in imperdiet et commodo vulputate justo in blandit ultrices enim lorem
693,3/5/2022,7535.11,withdrawal,Eabox,transportation,checking,Suchań,PLN,leo maecenas pulvinar lobortis est phasellus sit amet erat nulla tempus vivamus
694,3/5/2022,4568.56,deposit,Oloo,transportation,checking,Pedro Juan Caballero,PYG,lectus vestibulum quam sapien varius ut blandit non interdum in ante vestibulum ante ipsum primis in faucibus orci luctus
695,3/28/2022,9118.95,deposit,Flipbug,transportation,checking,Fushan,CNY,vel nulla eget eros elementum pellentesque quisque porta volutpat erat quisque
696,3/7/2022,9121.26,transfer,Feednation,transportation,credit card,Obala,XAF,placerat ante nulla justo aliquam quis turpis eget elit sodales scelerisque mauris sit amet eros suspendisse accumsan tortor
697,3/20/2022,4820.64,transfer,Kamba,entertainment,savings,Oklahoma City,USD,ante vel ipsum praesent blandit lacinia erat vestibulum sed magna at nunc
698,3/8/2022,4842.51,withdrawal,Agimba,utilities,checking,Ostrzeszów,PLN,velit nec nisi vulputate nonummy maecenas tincidunt lacus at velit vivamus vel nulla eget eros elementum pellentesque quisque porta
699,3/24/2022,5242.44,withdrawal,Skynoodle,transportation,checking,Qiulu,CNY,eu tincidunt in leo maecenas pulvinar lobortis est phasellus sit amet erat nulla tempus vivamus in felis eu
700,3/9/2022,1093.51,deposit,Photofeed,groceries,credit card,Tafeng,CNY,vulputate luctus cum sociis natoque penatibus et magnis dis parturient montes nascetur ridiculus mus vivamus
701,3/30/2022,8141.36,deposit,Brightbean,entertainment,credit card,Łaskarzew,PLN,sit amet sapien dignissim vestibulum vestibulum ante ipsum primis in faucibus orci luctus et ultrices posuere
702,3/12/2022,1552.34,transfer,Twinte,utilities,checking,Gelemso,ETB,elementum in hac habitasse platea dictumst morbi vestibulum velit id pretium
703,3/10/2022,666.73,transfer,Reallinks,entertainment,savings,El Ksour,TND,bibendum morbi non quam nec dui luctus rutrum nulla tellus in sagittis dui vel nisl duis ac nibh fusce lacus
704,3/3/2022,924.99,deposit,Meeveo,entertainment,checking,Cedry Wielkie,PLN,donec diam neque vestibulum eget vulputate ut ultrices vel augue vestibulum ante ipsum
705,3/8/2022,2552.48,deposit,Skiba,transportation,credit card,Koło,PLN,montes nascetur ridiculus mus vivamus vestibulum sagittis sapien cum sociis natoque penatibus et magnis dis parturient montes
706,3/8/2022,1961.7,withdrawal,Fiveclub,transportation,credit card,Camingawan,PHP,enim in tempor turpis nec euismod scelerisque quam turpis adipiscing lorem vitae mattis nibh ligula nec sem duis aliquam convallis
707,3/28/2022,8337.53,withdrawal,Browsebug,entertainment,savings,Efeng,CNY,sed lacus morbi sem mauris laoreet ut rhoncus aliquet pulvinar sed nisl
708,3/3/2022,266.29,transfer,Devshare,utilities,checking,Mielec,PLN,nam congue risus semper porta volutpat quam pede lobortis ligula sit amet
709,3/29/2022,2406.18,withdrawal,Rhyzio,utilities,checking,Prokop’yevsk,RUB,pede morbi porttitor lorem id ligula suspendisse ornare consequat lectus in est risus auctor sed tristique in tempus
710,3/1/2022,870.63,deposit,Livetube,entertainment,savings,Bitobe,IDR,vulputate justo in blandit ultrices enim lorem ipsum dolor sit amet consectetuer adipiscing elit proin interdum mauris non ligula pellentesque
711,3/22/2022,6339.33,withdrawal,Tagtune,groceries,checking,Pucacaca,PEN,non velit nec nisi vulputate nonummy maecenas tincidunt lacus at velit vivamus vel nulla eget eros
712,3/23/2022,2236.98,deposit,Jayo,utilities,credit card,Poctol,PHP,eleifend donec ut dolor morbi vel lectus in quam fringilla rhoncus mauris enim leo rhoncus sed vestibulum sit amet cursus
713,3/4/2022,7492.0,transfer,Janyx,groceries,credit card,Dobryatino,RUB,integer aliquet massa id lobortis convallis tortor risus dapibus augue vel accumsan tellus nisi eu orci mauris
714,3/27/2022,2644.82,transfer,Jabberbean,entertainment,checking,Nungwi,TZS,consequat lectus in est risus auctor sed tristique in tempus sit amet sem fusce consequat
715,3/16/2022,3718.79,transfer,Edgetag,utilities,checking,Beizhuang,CNY,augue vestibulum ante ipsum primis in faucibus orci luctus et
716,3/12/2022,9984.59,withdrawal,Mycat,transportation,credit card,Lomma,SEK,phasellus id sapien in sapien iaculis congue vivamus metus arcu adipiscing molestie hendrerit
717,3/10/2022,9992.36,withdrawal,Flashdog,groceries,checking,Waiwukak,IDR,venenatis lacinia aenean sit amet justo morbi ut odio cras mi pede malesuada in imperdiet
718,3/15/2022,320.58,transfer,Voomm,utilities,savings,Consolacion,PHP,ligula suspendisse ornare consequat lectus in est risus auctor sed tristique in tempus sit amet
719,3/21/2022,1285.28,transfer,Katz,groceries,savings,Boevange-sur-Attert,EUR,dui proin leo odio porttitor id consequat in consequat ut nulla sed accumsan felis ut at dolor quis odio
720,3/10/2022,1539.71,deposit,Thoughtsphere,transportation,savings,Jishan,CNY,aenean fermentum donec ut mauris eget massa tempor convallis nulla neque libero
721,3/14/2022,2680.3,deposit,Photolist,transportation,checking,Libas,PHP,eget eros elementum pellentesque quisque porta volutpat erat quisque erat eros viverra eget congue eget semper rutrum
722,3/10/2022,4986.6,transfer,Skinix,transportation,credit card,Gebang,IDR,in lectus pellentesque at nulla suspendisse potenti cras in purus eu magna vulputate luctus cum sociis
723,3/23/2022,8609.72,withdrawal,Babbleblab,utilities,checking,Dalan,CNY,congue vivamus metus arcu adipiscing molestie hendrerit at vulputate vitae nisl aenean lectus pellentesque eget nunc donec quis
724,3/28/2022,7877.79,transfer,Cogibox,utilities,credit card,Popielów,PLN,non pretium quis lectus suspendisse potenti in eleifend quam a odio
725,3/22/2022,1004.51,withdrawal,Skalith,transportation,savings,Xitiangezhuang,CNY,et magnis dis parturient montes nascetur ridiculus mus etiam vel augue vestibulum rutrum rutrum neque
726,3/1/2022,4572.73,transfer,Mynte,utilities,credit card,Sukpak,RUB,nunc donec quis orci eget orci vehicula condimentum curabitur in libero ut massa volutpat convallis morbi
727,3/1/2022,6428.58,withdrawal,Dynabox,transportation,checking,Xue’an,CNY,ipsum dolor sit amet consectetuer adipiscing elit proin interdum mauris non ligula pellentesque ultrices phasellus id sapien in sapien iaculis
728,3/24/2022,6928.1,deposit,Yodo,entertainment,credit card,Sanxi,CNY,turpis integer aliquet massa id lobortis convallis tortor risus dapibus augue
729,3/8/2022,8284.89,transfer,Wikido,transportation,credit card,Seputih,IDR,quis libero nullam sit amet turpis elementum ligula vehicula consequat morbi
730,3/19/2022,5385.7,transfer,Eayo,groceries,credit card,Cái Nhum,VND,mattis pulvinar nulla pede ullamcorper augue a suscipit nulla elit
731,3/11/2022,6707.23,withdrawal,Podcat,entertainment,credit card,Ussuriysk,RUB,velit nec nisi vulputate nonummy maecenas tincidunt lacus at velit vivamus vel
732,3/8/2022,568.04,transfer,Chatterbridge,entertainment,checking,Kushelevka,RUB,at feugiat non pretium quis lectus suspendisse potenti in eleifend
733,3/20/2022,2964.11,withdrawal,Trunyx,entertainment,credit card,Wysoka,PLN,eget vulputate ut ultrices vel augue vestibulum ante ipsum primis in
734,3/30/2022,1213.92,deposit,Fliptune,entertainment,credit card,Prachin Buri,THB,mus etiam vel augue vestibulum rutrum rutrum neque aenean auctor gravida sem praesent id massa id nisl venenatis lacinia aenean
735,3/27/2022,1287.53,withdrawal,Realfire,transportation,savings,Canton,USD,convallis tortor risus dapibus augue vel accumsan tellus nisi eu orci mauris lacinia sapien quis
736,3/4/2022,5245.74,transfer,Voonix,entertainment,credit card,Seia,EUR,orci luctus et ultrices posuere cubilia curae nulla dapibus dolor vel est donec odio
737,3/5/2022,3308.1,transfer,Meemm,entertainment,checking,Riyadh,SAR,quam nec dui luctus rutrum nulla tellus in sagittis dui vel nisl duis ac nibh fusce
738,3/13/2022,5878.07,withdrawal,Zoovu,groceries,checking,Francisco Villa,MXN,lorem id ligula suspendisse ornare consequat lectus in est risus auctor sed tristique in tempus
739,3/10/2022,7059.66,withdrawal,BlogXS,groceries,checking,Caitang,CNY,at nibh in hac habitasse platea dictumst aliquam augue quam
740,3/18/2022,6427.65,deposit,Abatz,entertainment,checking,Zebrzydowice,PLN,id consequat in consequat ut nulla sed accumsan felis ut at dolor quis
741,3/13/2022,6162.17,transfer,Skidoo,entertainment,checking,Trongsa,BTN,morbi odio odio elementum eu interdum eu tincidunt in leo maecenas pulvinar lobortis est phasellus sit amet
742,3/16/2022,7535.55,transfer,Quire,transportation,savings,Sarankhola,BDT,amet eleifend pede libero quis orci nullam molestie nibh in lectus pellentesque
743,3/3/2022,1755.44,deposit,Topiclounge,transportation,credit card,Bandar-e ‘Asalūyeh,IRR,magnis dis parturient montes nascetur ridiculus mus etiam vel augue vestibulum rutrum
744,3/24/2022,620.94,withdrawal,Edgetag,groceries,savings,Sorren Daya,IDR,pede justo lacinia eget tincidunt eget tempus vel pede morbi porttitor lorem id ligula
745,3/28/2022,6394.6,deposit,Skibox,groceries,savings,Krasiczyn,PLN,justo sit amet sapien dignissim vestibulum vestibulum ante ipsum primis in faucibus orci luctus et ultrices posuere cubilia curae nulla
746,3/28/2022,1669.29,withdrawal,Buzzbean,groceries,credit card,Río Grande,PEN,felis fusce posuere felis sed lacus morbi sem mauris laoreet ut rhoncus aliquet pulvinar sed nisl nunc
747,3/25/2022,4595.1,deposit,Skibox,utilities,savings,Emiliano Zapata,MXN,amet eleifend pede libero quis orci nullam molestie nibh in lectus pellentesque at
748,3/14/2022,3046.4,withdrawal,Photobug,groceries,credit card,Elefsína,EUR,nullam sit amet turpis elementum ligula vehicula consequat morbi a ipsum
749,3/12/2022,9878.8,transfer,Wordpedia,entertainment,credit card,Alcalá,COP,eleifend luctus ultricies eu nibh quisque id justo sit amet sapien dignissim vestibulum vestibulum ante ipsum primis in
750,3/21/2022,2167.17,deposit,Zoonoodle,entertainment,checking,Heku,CNY,justo lacinia eget tincidunt eget tempus vel pede morbi porttitor lorem id ligula
751,3/14/2022,157.03,transfer,Devpulse,groceries,checking,Fenjie,CNY,odio cras mi pede malesuada in imperdiet et commodo vulputate justo
752,3/29/2022,3908.78,deposit,Wikido,transportation,credit card,Cap-Santé,CAD,at ipsum ac tellus semper interdum mauris ullamcorper purus sit
753,3/8/2022,8190.43,withdrawal,Voolith,transportation,credit card,Salor,UZS,quis orci eget orci vehicula condimentum curabitur in libero ut massa volutpat convallis morbi odio odio elementum
754,3/11/2022,9973.26,deposit,Devpoint,groceries,checking,Panikihan,PHP,proin interdum mauris non ligula pellentesque ultrices phasellus id sapien in sapien
755,3/28/2022,78.52,withdrawal,Eire,transportation,savings,Maonon,PHP,ac leo pellentesque ultrices mattis odio donec vitae nisi nam
