transaction_id,transaction_date,amount,transaction_type,merchant_name,category,account_type,location,currency,description
606,5/5/2022,8523.3,withdrawal,Riffpath,entertainment,checking,Keti Bandar,PKR,at turpis a pede posuere nonummy integer non velit donec diam
607,5/15/2022,3687.23,deposit,Feednation,entertainment,credit card,Sishiba,CNY,penatibus et magnis dis parturient montes nascetur ridiculus mus etiam vel
608,5/8/2022,8034.1,withdrawal,Babbleblab,utilities,savings,Tajao,PHP,nisi nam ultrices libero non mattis pulvinar nulla pede ullamcorper augue a suscipit nulla elit ac nulla sed vel
609,5/25/2022,1501.32,withdrawal,Ntags,entertainment,credit card,Kozmice,CZK,sed ante vivamus tortor duis mattis egestas metus aenean fermentum donec ut mauris
610,5/6/2022,4113.75,transfer,Trupe,groceries,checking,Ngenden,IDR,convallis duis consequat dui nec nisi volutpat eleifend donec ut dolor
611,5/24/2022,226.56,deposit,Twitterbeat,entertainment,checking,Mene de Mauroa,VEF,sit amet sapien dignissim vestibulum vestibulum ante ipsum primis in faucibus
612,5/12/2022,8883.15,withdrawal,Yombu,groceries,savings,Voyskovitsy,RUB,ante ipsum primis in faucibus orci luctus et ultrices posuere
613,5/18/2022,5735.23,deposit,Eabox,entertainment,checking,Kingscourt,EUR,donec dapibus duis at velit eu est congue elementum in hac habitasse platea dictumst morbi vestibulum
614,5/7/2022,5964.48,transfer,Leexo,groceries,credit card,Zbrosławice,PLN,in consequat ut nulla sed accumsan felis ut at dolor quis odio consequat varius
615,5/15/2022,1700.61,withdrawal,Photojam,entertainment,savings,Linfen,CNY,erat curabitur gravida nisi at nibh in hac habitasse platea dictumst aliquam augue
616,5/8/2022,796.54,deposit,Photospace,groceries,checking,Orekhovo-Zuyevo,RUB,adipiscing elit proin risus praesent lectus vestibulum quam sapien varius ut blandit non interdum in ante vestibulum ante ipsum
617,5/3/2022,2370.88,transfer,Tagtune,utilities,checking,Cabadiangan,PHP,risus auctor sed tristique in tempus sit amet sem fusce consequat nulla nisl
618,5/1/2022,2846.88,transfer,Flashpoint,entertainment,credit card,Karakol,KGS,risus praesent lectus vestibulum quam sapien varius ut blandit non interdum in ante vestibulum ante ipsum primis in
619,5/4/2022,7435.65,withdrawal,Topdrive,entertainment,credit card,Anjirserapat,IDR,sem praesent id massa id nisl venenatis lacinia aenean sit amet justo morbi
620,5/11/2022,8051.65,deposit,Wordify,transportation,checking,Tarbes,EUR,lacus morbi quis tortor id nulla ultrices aliquet maecenas leo
621,5/1/2022,2067.65,withdrawal,Oyondu,utilities,credit card,Siraway,PHP,risus dapibus augue vel accumsan tellus nisi eu orci mauris lacinia sapien quis libero
622,5/27/2022,28.61,withdrawal,Vidoo,utilities,checking,Qidu,CNY,consectetuer adipiscing elit proin risus praesent lectus vestibulum quam sapien varius ut blandit non interdum in
623,5/11/2022,1981.11,deposit,Dynazzy,transportation,credit card,Witbank,ZAR,fusce congue diam id ornare imperdiet sapien urna pretium nisl ut volutpat sapien arcu sed augue aliquam erat volutpat in
624,5/1/2022,6608.56,transfer,Browsebug,entertainment,savings,Amieiro,EUR,dapibus dolor vel est donec odio justo sollicitudin ut suscipit a feugiat et eros vestibulum ac est lacinia nisi
625,5/24/2022,8325.99,transfer,Gabspot,entertainment,credit card,Tamboril,DOP,quisque arcu libero rutrum ac lobortis vel dapibus at diam nam tristique tortor eu pede
626,5/6/2022,5622.94,withdrawal,Tekfly,utilities,savings,Shuinanxu,CNY,vestibulum ante ipsum primis in faucibus orci luctus et ultrices posuere cubilia curae mauris viverra diam vitae quam
627,5/24/2022,6369.0,deposit,Reallinks,transportation,savings,Mujur Satu,IDR,nulla tellus in sagittis dui vel nisl duis ac nibh fusce lacus purus aliquet
628,5/1/2022,8651.61,withdrawal,Blogtag,groceries,credit card,Montego Bay,JMD,proin at turpis a pede posuere nonummy integer non velit donec diam neque vestibulum eget vulputate ut
629,5/6/2022,3572.89,transfer,Devpulse,utilities,savings,Jizhou,CNY,suscipit a feugiat et eros vestibulum ac est lacinia nisi
630,5/12/2022,5433.92,deposit,Mycat,utilities,savings,Mocun,CNY,consectetuer adipiscing elit proin interdum mauris non ligula pellentesque ultrices phasellus id sapien in
631,5/27/2022,7959.6,withdrawal,Ooba,groceries,credit card,Los Angeles,MXN,in tempor turpis nec euismod scelerisque quam turpis adipiscing lorem vitae mattis nibh ligula nec sem duis
632,5/13/2022,9922.94,deposit,Janyx,utilities,savings,Kangasala,EUR,aenean fermentum donec ut mauris eget massa tempor convallis nulla neque libero convallis eget eleifend luctus ultricies eu nibh
633,5/14/2022,1620.98,deposit,Voomm,utilities,credit card,Lazaro Cardenas,MXN,maecenas leo odio condimentum id luctus nec molestie sed justo pellentesque
634,5/21/2022,8359.88,deposit,Dabtype,utilities,checking,Miānwāli,PKR,in consequat ut nulla sed accumsan felis ut at dolor quis odio consequat varius integer ac
635,5/30/2022,1122.59,deposit,Jabberstorm,groceries,credit card,Jāsim,SYP,amet nulla quisque arcu libero rutrum ac lobortis vel dapibus at diam nam tristique tortor eu
636,5/27/2022,2326.75,withdrawal,Buzzdog,groceries,checking,Dzüünkharaa,MNT,erat quisque erat eros viverra eget congue eget semper rutrum nulla nunc purus phasellus in felis donec semper sapien
637,5/14/2022,799.77,deposit,JumpXS,transportation,checking,‘Amrān,YER,luctus cum sociis natoque penatibus et magnis dis parturient montes nascetur ridiculus
638,5/29/2022,3664.9,withdrawal,Babbleblab,entertainment,credit card,Yingcui,CNY,integer non velit donec diam neque vestibulum eget vulputate ut ultrices vel
639,5/17/2022,6988.77,withdrawal,Katz,transportation,credit card,Bobai,CNY,consequat lectus in est risus auctor sed tristique in tempus sit amet
640,5/29/2022,4578.03,deposit,Yakijo,entertainment,savings,San Francisco,COP,nullam molestie nibh in lectus pellentesque at nulla suspendisse potenti cras
641,5/23/2022,2771.2,withdrawal,Blogtags,entertainment,savings,Železná Ruda,CZK,eu felis fusce posuere felis sed lacus morbi sem mauris laoreet ut rhoncus aliquet pulvinar sed nisl nunc
642,5/5/2022,4063.97,withdrawal,Topiczoom,utilities,checking,Kotovsk,RUB,augue luctus tincidunt nulla mollis molestie lorem quisque ut erat curabitur gravida nisi
643,5/8/2022,2997.71,withdrawal,Meetz,entertainment,savings,Horní Libina,CZK,maecenas leo odio condimentum id luctus nec molestie sed justo pellentesque viverra pede ac diam cras pellentesque
644,5/10/2022,8690.58,withdrawal,Eire,utilities,checking,Lokosovo,RUB,elit sodales scelerisque mauris sit amet eros suspendisse accumsan tortor quis turpis sed ante vivamus tortor
645,5/20/2022,2309.98,deposit,Jamia,transportation,checking,Žihle,CZK,sit amet sem fusce consequat nulla nisl nunc nisl duis bibendum
646,5/8/2022,5619.46,withdrawal,Ntags,entertainment,credit card,Yuci,CNY,nisl duis ac nibh fusce lacus purus aliquet at feugiat non pretium quis lectus suspendisse
647,5/5/2022,6694.28,deposit,Photojam,entertainment,credit card,Sirnasari,IDR,primis in faucibus orci luctus et ultrices posuere cubilia curae donec pharetra magna vestibulum aliquet ultrices erat tortor
648,5/6/2022,390.58,transfer,Gevee,entertainment,savings,Kissónerga,EUR,magna ac consequat metus sapien ut nunc vestibulum ante ipsum primis in faucibus
649,5/12/2022,2856.22,withdrawal,Jaxspan,entertainment,checking,Charleston,USD,morbi quis tortor id nulla ultrices aliquet maecenas leo odio condimentum id luctus nec molestie sed justo
650,5/26/2022,1142.89,deposit,Voomm,utilities,checking,Tartagal,ARS,quam turpis adipiscing lorem vitae mattis nibh ligula nec sem duis aliquam convallis nunc proin at turpis a
651,5/20/2022,4925.29,withdrawal,Mymm,transportation,savings,Pulau Pinang,MYR,vulputate luctus cum sociis natoque penatibus et magnis dis parturient
652,5/24/2022,5221.34,deposit,Skinte,groceries,savings,Bystřice nad Pernštejnem,CZK,posuere cubilia curae duis faucibus accumsan odio curabitur convallis duis consequat dui nec nisi volutpat eleifend donec ut dolor
653,5/3/2022,4722.15,transfer,Wikivu,transportation,checking,Lusaka,ZMW,ut dolor morbi vel lectus in quam fringilla rhoncus mauris
654,5/4/2022,5129.57,withdrawal,Topicblab,groceries,checking,Susuman,RUB,vivamus in felis eu sapien cursus vestibulum proin eu mi nulla ac enim in
655,5/12/2022,5044.92,withdrawal,Divavu,entertainment,checking,Chernyshevsk,RUB,dapibus nulla suscipit ligula in lacus curabitur at ipsum ac tellus semper interdum mauris ullamcorper purus sit amet nulla quisque
656,5/9/2022,5153.82,transfer,Photobug,utilities,savings,Witihama,IDR,a libero nam dui proin leo odio porttitor id consequat in consequat ut nulla sed
657,5/12/2022,3331.99,withdrawal,Realpoint,entertainment,savings,Shihuiqiao,CNY,ut massa quis augue luctus tincidunt nulla mollis molestie lorem quisque ut erat curabitur
658,5/21/2022,615.83,transfer,Linklinks,entertainment,credit card,Oele,IDR,augue luctus tincidunt nulla mollis molestie lorem quisque ut erat curabitur gravida nisi at nibh in
659,5/25/2022,3906.41,deposit,Leenti,transportation,credit card,Obita,JPY,vitae consectetuer eget rutrum at lorem integer tincidunt ante vel ipsum praesent blandit lacinia erat vestibulum
660,5/7/2022,9238.35,withdrawal,Jabbercube,groceries,savings,Timur,IDR,ullamcorper purus sit amet nulla quisque arcu libero rutrum ac lobortis
661,5/7/2022,5737.54,transfer,Buzzdog,utilities,credit card,Cinyawang,IDR,cursus vestibulum proin eu mi nulla ac enim in tempor turpis nec euismod scelerisque
662,5/28/2022,5118.69,withdrawal,Babbleblab,entertainment,savings,Al Fashn,EGP,tellus in sagittis dui vel nisl duis ac nibh fusce lacus purus aliquet at
663,5/9/2022,3260.84,transfer,Thoughtsphere,entertainment,checking,Baltimore,USD,est donec odio justo sollicitudin ut suscipit a feugiat et eros vestibulum ac
664,5/28/2022,1032.9,transfer,Linktype,transportation,credit card,Radès,TND,aenean lectus pellentesque eget nunc donec quis orci eget orci vehicula condimentum curabitur
665,5/15/2022,1274.46,transfer,Livepath,groceries,credit card,Yelizavetino,RUB,aliquet ultrices erat tortor sollicitudin mi sit amet lobortis sapien sapien non mi integer ac
666,5/8/2022,981.89,transfer,Skivee,utilities,checking,Sevilla,COP,vehicula consequat morbi a ipsum integer a nibh in quis justo maecenas rhoncus aliquam lacus morbi
667,5/29/2022,8975.05,deposit,Kayveo,entertainment,checking,Žatec,CZK,arcu sed augue aliquam erat volutpat in congue etiam justo etiam pretium iaculis justo in hac habitasse platea
668,5/23/2022,1614.81,withdrawal,Npath,utilities,credit card,Besuk Selatan,IDR,aliquet pulvinar sed nisl nunc rhoncus dui vel sem sed sagittis nam congue
669,5/23/2022,3424.74,deposit,Devshare,entertainment,checking,Dmytrivka,UAH,curae donec pharetra magna vestibulum aliquet ultrices erat tortor sollicitudin mi sit amet lobortis sapien sapien non mi
670,5/20/2022,6596.79,deposit,Blogspan,groceries,credit card,Jeziorzany,PLN,velit vivamus vel nulla eget eros elementum pellentesque quisque porta volutpat erat quisque erat eros viverra eget congue eget semper
671,5/25/2022,9311.63,withdrawal,Kimia,utilities,savings,Xiangyanglu,CNY,vestibulum sit amet cursus id turpis integer aliquet massa id lobortis convallis tortor risus
672,5/4/2022,4946.1,deposit,Pixonyx,entertainment,savings,Bangko,IDR,quisque ut erat curabitur gravida nisi at nibh in hac habitasse platea dictumst aliquam augue quam sollicitudin vitae consectetuer eget
673,5/3/2022,9651.66,transfer,Wordify,groceries,savings,Lavaur,EUR,etiam justo etiam pretium iaculis justo in hac habitasse platea dictumst etiam faucibus
674,5/10/2022,431.1,transfer,Mybuzz,utilities,checking,Aktogay,KZT,turpis integer aliquet massa id lobortis convallis tortor risus dapibus augue vel accumsan tellus nisi eu orci
675,5/14/2022,1387.08,deposit,Edgeclub,entertainment,credit card,Ḩawf,YER,elementum ligula vehicula consequat morbi a ipsum integer a nibh in quis justo maecenas rhoncus aliquam lacus morbi quis
676,5/3/2022,374.34,transfer,Ooba,groceries,checking,Madura,IDR,quam sollicitudin vitae consectetuer eget rutrum at lorem integer tincidunt ante
677,5/28/2022,9618.74,withdrawal,Skajo,utilities,savings,Aucayacu,PEN,vitae nisi nam ultrices libero non mattis pulvinar nulla pede ullamcorper augue a suscipit nulla elit ac nulla sed vel
678,5/28/2022,5347.06,transfer,Ntags,utilities,credit card,Kasulu,TZS,nonummy maecenas tincidunt lacus at velit vivamus vel nulla eget eros
679,5/15/2022,2113.27,deposit,Gabtune,transportation,savings,Bilohirs’k,UAH,lacinia aenean sit amet justo morbi ut odio cras mi pede malesuada in imperdiet et commodo vulputate justo in blandit
680,5/20/2022,1338.7,withdrawal,Yacero,transportation,checking,Milton,GBP,eget nunc donec quis orci eget orci vehicula condimentum curabitur in libero ut massa volutpat convallis morbi odio odio
681,5/2/2022,3899.78,transfer,Meetz,entertainment,savings,Głuchołazy,PLN,id lobortis convallis tortor risus dapibus augue vel accumsan tellus nisi eu orci mauris lacinia sapien quis
682,5/22/2022,9371.57,withdrawal,Snaptags,entertainment,checking,Shagedu,CNY,justo pellentesque viverra pede ac diam cras pellentesque volutpat dui maecenas tristique est et
683,5/15/2022,6812.65,deposit,Ntag,transportation,credit card,Plaridel,PHP,pellentesque ultrices phasellus id sapien in sapien iaculis congue vivamus metus
684,5/9/2022,131.48,transfer,Buzzster,groceries,savings,Buenos Aires,HNL,ipsum praesent blandit lacinia erat vestibulum sed magna at nunc commodo
685,5/26/2022,2957.5,deposit,Eayo,transportation,credit card,Kertanegla,IDR,potenti in eleifend quam a odio in hac habitasse platea dictumst maecenas ut
686,5/28/2022,5929.01,transfer,Chatterbridge,entertainment,checking,Uthai,THB,nullam varius nulla facilisi cras non velit nec nisi vulputate nonummy maecenas
687,5/26/2022,9226.56,withdrawal,Flashspan,groceries,credit card,Yukuriawat,CNY,amet eleifend pede libero quis orci nullam molestie nibh in lectus pellentesque at nulla
688,5/15/2022,389.39,withdrawal,Shuffledrive,transportation,credit card,Tairan Camp,PHP,amet turpis elementum ligula vehicula consequat morbi a ipsum integer a nibh in quis justo maecenas rhoncus aliquam lacus morbi
689,5/22/2022,9983.08,withdrawal,Voomm,transportation,credit card,Artjärvi,EUR,congue eget semper rutrum nulla nunc purus phasellus in felis donec semper sapien a
690,5/18/2022,1552.87,transfer,Realbuzz,entertainment,savings,Mādabā,JOD,diam vitae quam suspendisse potenti nullam porttitor lacus at turpis donec posuere metus vitae ipsum
691,5/26/2022,9050.14,withdrawal,Trilith,utilities,savings,Pimenta Bueno,BRL,varius integer ac leo pellentesque ultrices mattis odio donec vitae nisi nam ultrices libero non
692,5/9/2022,2841.46,deposit,Voonte,groceries,credit card,Labney,PHP,hac habitasse platea dictumst maecenas ut massa quis augue luctus tincidunt
693,5/10/2022,6508.01,transfer,Trunyx,groceries,credit card,Bartošovice,CZK,volutpat in congue etiam justo etiam pretium iaculis justo in hac habitasse platea dictumst
694,5/21/2022,1130.34,transfer,Trilith,utilities,checking,Chumikan,RUB,ut volutpat sapien arcu sed augue aliquam erat volutpat in congue etiam justo
695,5/20/2022,9560.92,transfer,Janyx,utilities,credit card,Ulichnoye,UAH,etiam pretium iaculis justo in hac habitasse platea dictumst etiam faucibus cursus urna
696,5/19/2022,7055.4,transfer,Buzzdog,entertainment,checking,Fengping,CNY,tempor turpis nec euismod scelerisque quam turpis adipiscing lorem vitae mattis nibh ligula nec sem
697,5/21/2022,1463.28,withdrawal,Thoughtstorm,utilities,credit card,Tysmenychany,UAH,vel sem sed sagittis nam congue risus semper porta volutpat
698,5/27/2022,1667.48,withdrawal,Photolist,utilities,credit card,Tukbur,IDR,eget semper rutrum nulla nunc purus phasellus in felis donec semper sapien a libero nam dui
699,5/5/2022,567.78,deposit,Camido,entertainment,checking,Char Bhadrāsan,BDT,in faucibus orci luctus et ultrices posuere cubilia curae nulla dapibus dolor vel est donec odio justo sollicitudin
700,5/15/2022,4272.97,withdrawal,Vinte,utilities,savings,Madalena,EUR,sit amet lobortis sapien sapien non mi integer ac neque duis bibendum morbi non quam nec dui luctus rutrum nulla
701,5/25/2022,4179.38,transfer,Gevee,groceries,credit card,Radzyń Chełmiński,PLN,volutpat erat quisque erat eros viverra eget congue eget semper rutrum nulla nunc
702,5/26/2022,721.5,transfer,BlogXS,utilities,savings,Lages,EUR,eros suspendisse accumsan tortor quis turpis sed ante vivamus tortor duis
703,5/11/2022,9481.09,withdrawal,Yombu,utilities,savings,Lolayan,IDR,mattis egestas metus aenean fermentum donec ut mauris eget massa tempor convallis nulla neque libero
704,5/1/2022,357.73,deposit,Quimba,utilities,credit card,Chernyshevsk,RUB,cubilia curae donec pharetra magna vestibulum aliquet ultrices erat tortor sollicitudin mi sit amet lobortis sapien
705,5/5/2022,1815.95,deposit,Blogtags,groceries,savings,Karlstad,SEK,vulputate justo in blandit ultrices enim lorem ipsum dolor sit amet consectetuer adipiscing
706,5/7/2022,2068.53,deposit,Buzzbean,utilities,checking,Surkhakhi,RUB,ante ipsum primis in faucibus orci luctus et ultrices posuere cubilia
707,5/15/2022,6246.23,deposit,Mymm,transportation,savings,Talagasari,IDR,a pede posuere nonummy integer non velit donec diam neque vestibulum eget vulputate
708,5/24/2022,2832.37,deposit,Meezzy,utilities,checking,Radekhiv,UAH,posuere cubilia curae duis faucibus accumsan odio curabitur convallis duis consequat dui nec nisi volutpat eleifend donec ut dolor morbi
709,5/13/2022,837.08,deposit,Twimm,transportation,savings,San Mariano,PHP,faucibus orci luctus et ultrices posuere cubilia curae donec pharetra magna vestibulum aliquet
710,5/7/2022,6419.9,withdrawal,Bluejam,utilities,checking,Montréal-Ouest,CAD,nulla ultrices aliquet maecenas leo odio condimentum id luctus nec molestie sed justo pellentesque viverra
711,5/26/2022,7057.71,transfer,Gabtype,groceries,credit card,Longxi,CNY,elit proin risus praesent lectus vestibulum quam sapien varius ut blandit non
712,5/15/2022,4523.23,deposit,Yodoo,transportation,checking,Xinchenglu,CNY,aliquam augue quam sollicitudin vitae consectetuer eget rutrum at lorem integer tincidunt ante
713,5/14/2022,7859.86,withdrawal,Tagcat,utilities,checking,Cerro Corá,ARS,justo eu massa donec dapibus duis at velit eu est congue elementum in hac habitasse platea dictumst morbi vestibulum
714,5/5/2022,9302.54,transfer,Twinder,entertainment,checking,Terezín,CZK,ut suscipit a feugiat et eros vestibulum ac est lacinia nisi
715,5/17/2022,5054.1,transfer,Dazzlesphere,utilities,credit card,El Nido,PHP,dictumst aliquam augue quam sollicitudin vitae consectetuer eget rutrum at lorem integer tincidunt ante vel ipsum praesent blandit lacinia erat
716,5/5/2022,3796.02,withdrawal,Zoomlounge,groceries,checking,Ngawi,IDR,morbi sem mauris laoreet ut rhoncus aliquet pulvinar sed nisl nunc rhoncus
717,5/2/2022,1159.05,withdrawal,Tanoodle,entertainment,savings,Kafr Baţnā,SYP,id turpis integer aliquet massa id lobortis convallis tortor risus dapibus augue vel accumsan tellus
718,5/29/2022,2203.04,deposit,Oozz,transportation,savings,Luanshya,ZMW,vel pede morbi porttitor lorem id ligula suspendisse ornare consequat lectus in est risus auctor sed tristique
719,5/3/2022,596.26,withdrawal,Dabjam,transportation,credit card,Tipitapa,NIO,cras non velit nec nisi vulputate nonummy maecenas tincidunt lacus at
720,5/14/2022,6735.1,transfer,Devpoint,utilities,credit card,Jalingo,NGN,enim in tempor turpis nec euismod scelerisque quam turpis adipiscing lorem vitae mattis nibh ligula
721,5/19/2022,5423.76,transfer,Bluejam,groceries,credit card,Genisséa,EUR,egestas metus aenean fermentum donec ut mauris eget massa tempor convallis nulla neque
722,5/15/2022,4110.41,deposit,Devbug,entertainment,checking,Qusar,AZN,euismod scelerisque quam turpis adipiscing lorem vitae mattis nibh ligula nec
723,5/20/2022,8354.84,withdrawal,Snaptags,transportation,credit card,Kobuleti,GEL,interdum mauris non ligula pellentesque ultrices phasellus id sapien in sapien iaculis congue vivamus metus arcu adipiscing molestie
724,5/24/2022,4537.08,transfer,Blogtag,entertainment,savings,San Pedro Zacapa,HNL,vel est donec odio justo sollicitudin ut suscipit a feugiat et eros vestibulum ac est lacinia nisi venenatis tristique
725,5/14/2022,3007.19,deposit,Eimbee,groceries,credit card,Novaya Usman’,RUB,justo in hac habitasse platea dictumst etiam faucibus cursus urna
726,5/10/2022,6646.9,transfer,Twitterwire,utilities,savings,Las Cruces,USD,non mi integer ac neque duis bibendum morbi non quam nec dui luctus rutrum nulla tellus in sagittis dui
727,5/16/2022,8636.67,withdrawal,Blognation,groceries,checking,Dujuuma,SOS,libero ut massa volutpat convallis morbi odio odio elementum eu interdum eu tincidunt in leo
728,5/8/2022,1390.52,deposit,Quinu,entertainment,savings,Cowansville,CAD,fusce congue diam id ornare imperdiet sapien urna pretium nisl ut volutpat sapien arcu sed
729,5/13/2022,7163.36,deposit,Meevee,transportation,credit card,Samamiya,NGN,at nunc commodo placerat praesent blandit nam nulla integer pede justo lacinia eget tincidunt
730,5/16/2022,2586.62,deposit,Twitterbeat,entertainment,checking,Tonantins,BRL,pede libero quis orci nullam molestie nibh in lectus pellentesque at nulla suspendisse
731,5/16/2022,5783.78,withdrawal,Jabbertype,utilities,checking,Venlo,EUR,ut at dolor quis odio consequat varius integer ac leo pellentesque ultrices mattis odio donec vitae nisi
732,5/11/2022,6106.26,deposit,Dazzlesphere,utilities,credit card,Jaru,BRL,vestibulum ac est lacinia nisi venenatis tristique fusce congue diam id ornare imperdiet sapien urna pretium nisl ut volutpat
733,5/15/2022,9598.01,deposit,Skippad,transportation,savings,Puračić,BAM,luctus et ultrices posuere cubilia curae nulla dapibus dolor vel est donec
734,5/10/2022,8907.36,withdrawal,Yakijo,groceries,checking,Las Lajas,HNL,magna at nunc commodo placerat praesent blandit nam nulla integer pede
735,5/23/2022,278.43,deposit,Rhycero,transportation,credit card,Grindavík,ISK,consectetuer eget rutrum at lorem integer tincidunt ante vel ipsum praesent blandit lacinia erat vestibulum sed magna at nunc commodo
736,5/21/2022,8898.33,transfer,Browsecat,transportation,checking,Xue’an,CNY,accumsan tortor quis turpis sed ante vivamus tortor duis mattis egestas metus
737,5/1/2022,1341.95,withdrawal,Jetpulse,entertainment,credit card,Kyegegwa,UGX,in blandit ultrices enim lorem ipsum dolor sit amet consectetuer
738,5/13/2022,9286.52,withdrawal,Divape,transportation,savings,Sacramento,USD,leo rhoncus sed vestibulum sit amet cursus id turpis integer aliquet massa id lobortis convallis tortor risus dapibus augue vel
739,5/17/2022,5048.37,withdrawal,Teklist,entertainment,checking,Yuen Long Kau Hui,HKD,libero ut massa volutpat convallis morbi odio odio elementum eu interdum eu
740,5/29/2022,9735.28,deposit,Yotz,utilities,savings,Bánica,DOP,nunc nisl duis bibendum felis sed interdum venenatis turpis enim blandit
741,5/11/2022,994.57,transfer,Jabbertype,utilities,credit card,Baishi,CNY,amet diam in magna bibendum imperdiet nullam orci pede venenatis non sodales
742,5/21/2022,4077.98,deposit,Leexo,transportation,savings,Yunxi,CNY,volutpat convallis morbi odio odio elementum eu interdum eu tincidunt in leo maecenas pulvinar lobortis est
743,5/7/2022,2491.87,withdrawal,Meetz,utilities,checking,Norcasia,COP,est risus auctor sed tristique in tempus sit amet sem fusce consequat nulla nisl
744,5/11/2022,7838.46,deposit,Zoonder,transportation,savings,Nong Khai,THB,augue luctus tincidunt nulla mollis molestie lorem quisque ut erat curabitur gravida nisi at nibh
745,5/9/2022,3884.95,withdrawal,Centimia,groceries,credit card,Puerto Deseado,ARS,libero nam dui proin leo odio porttitor id consequat in consequat ut nulla sed accumsan felis ut at dolor
746,5/5/2022,871.05,withdrawal,Browsezoom,groceries,credit card,Huicheng,CNY,est congue elementum in hac habitasse platea dictumst morbi vestibulum velit id pretium iaculis diam erat fermentum justo nec
747,5/10/2022,7619.27,withdrawal,Jamia,entertainment,credit card,Carigara,PHP,commodo placerat praesent blandit nam nulla integer pede justo lacinia eget tincidunt
748,5/20/2022,9635.88,transfer,Voonder,utilities,checking,Brest,EUR,nulla suscipit ligula in lacus curabitur at ipsum ac tellus semper
749,5/24/2022,7312.05,withdrawal,Bubbletube,entertainment,credit card,San Cosme y Damián,PYG,in quis justo maecenas rhoncus aliquam lacus morbi quis tortor id nulla ultrices aliquet maecenas leo odio condimentum id
750,5/27/2022,9200.33,deposit,Yakitri,entertainment,credit card,Tisno,HRK,nulla elit ac nulla sed vel enim sit amet nunc viverra dapibus nulla suscipit ligula in lacus
751,5/24/2022,8170.99,transfer,Tazz,utilities,savings,Purong,CNY,praesent lectus vestibulum quam sapien varius ut blandit non interdum in ante vestibulum ante
752,5/24/2022,9716.23,transfer,Gabtype,transportation,savings,Duoxiang,CNY,orci eget orci vehicula condimentum curabitur in libero ut massa volutpat convallis morbi odio odio
753,5/1/2022,566.29,withdrawal,Yadel,groceries,credit card,Gwangtan,KRW,eu mi nulla ac enim in tempor turpis nec euismod scelerisque quam turpis adipiscing
754,5/29/2022,4084.43,deposit,Skalith,groceries,savings,Curuzú Cuatiá,ARS,amet consectetuer adipiscing elit proin interdum mauris non ligula pellentesque ultrices
755,5/22/2022,5253.79,withdrawal,Twitterwire,entertainment,credit card,Gulou,CNY,vulputate elementum nullam varius nulla facilisi cras non velit nec nisi vulputate nonummy
756,5/22/2022,4765.7,deposit,Yakitri,utilities,savings,Ath,EUR,mi nulla ac enim in tempor turpis nec euismod scelerisque quam turpis adipiscing lorem vitae mattis nibh
757,5/1/2022,4813.73,deposit,Eire,utilities,savings,Ulety,RUB,luctus et ultrices posuere cubilia curae donec pharetra magna vestibulum aliquet ultrices erat tortor sollicitudin mi
