transaction_id,transaction_date,amount,transaction_type,merchant_name,category,account_type,location,currency,description
303,5/29/2022,5741.69,transfer,Edgeblab,transportation,savings,Nggambel,IDR,vestibulum ante ipsum primis in faucibus orci luctus et ultrices posuere cubilia curae nulla dapibus dolor vel est donec odio
304,5/20/2022,142.02,withdrawal,Brightbean,groceries,checking,Lasi Dua,IDR,phasellus in felis donec semper sapien a libero nam dui proin leo odio porttitor id consequat in
305,5/11/2022,5822.95,deposit,Feedmix,entertainment,credit card,Gérakas,EUR,at vulputate vitae nisl aenean lectus pellentesque eget nunc donec quis orci eget
306,5/14/2022,8930.88,transfer,Fivespan,transportation,checking,Huanren,CNY,lacinia aenean sit amet justo morbi ut odio cras mi pede malesuada in imperdiet et commodo vulputate justo in blandit
307,5/19/2022,6827.05,transfer,Dabvine,transportation,checking,Oyabe,JPY,nonummy integer non velit donec diam neque vestibulum eget vulputate ut ultrices vel augue vestibulum ante ipsum primis in
308,5/5/2022,155.11,withdrawal,Fliptune,groceries,savings,Swords,EUR,massa tempor convallis nulla neque libero convallis eget eleifend luctus ultricies eu
309,5/20/2022,201.11,transfer,Flashspan,entertainment,savings,Jeremi,HTG,molestie sed justo pellentesque viverra pede ac diam cras pellentesque volutpat dui maecenas
310,5/26/2022,8891.09,withdrawal,Podcat,transportation,checking,Talok,IDR,iaculis diam erat fermentum justo nec condimentum neque sapien placerat
311,5/1/2022,7356.23,transfer,Divanoodle,transportation,checking,Sepolong Timur,IDR,lorem ipsum dolor sit amet consectetuer adipiscing elit proin interdum mauris non ligula pellentesque ultrices phasellus id
312,5/25/2022,6898.95,withdrawal,Yacero,transportation,savings,Qingduizi,CNY,posuere cubilia curae nulla dapibus dolor vel est donec odio justo sollicitudin ut
313,5/24/2022,5229.0,withdrawal,Rhybox,entertainment,credit card,Dagang,CNY,quis justo maecenas rhoncus aliquam lacus morbi quis tortor id nulla ultrices aliquet maecenas leo odio condimentum id luctus
314,5/16/2022,1631.06,withdrawal,Demizz,entertainment,checking,Macau,MOP,eros elementum pellentesque quisque porta volutpat erat quisque erat eros viverra eget congue eget semper rutrum nulla
315,5/30/2022,4243.29,withdrawal,Babbleset,groceries,savings,Göteborg,SEK,nec euismod scelerisque quam turpis adipiscing lorem vitae mattis nibh ligula nec sem duis aliquam
316,5/24/2022,1489.13,deposit,Meeveo,entertainment,savings,Bhisho,ZAR,vel augue vestibulum ante ipsum primis in faucibus orci luctus et ultrices posuere cubilia curae donec pharetra magna
317,5/1/2022,8128.59,deposit,Oyope,utilities,checking,Duncans,JMD,donec diam neque vestibulum eget vulputate ut ultrices vel augue vestibulum ante ipsum primis in faucibus orci luctus
318,5/21/2022,8049.15,withdrawal,Zooxo,entertainment,credit card,Paradela,EUR,morbi non quam nec dui luctus rutrum nulla tellus in sagittis dui vel nisl duis ac nibh fusce lacus
319,5/17/2022,7421.58,withdrawal,Brainverse,utilities,checking,Lethem,GYD,porttitor lacus at turpis donec posuere metus vitae ipsum aliquam
320,5/26/2022,6236.45,transfer,Jetwire,transportation,savings,Xihe,CNY,tempor turpis nec euismod scelerisque quam turpis adipiscing lorem vitae mattis nibh ligula nec sem duis
321,5/7/2022,9633.22,deposit,Bubbletube,utilities,checking,Salcedo,PHP,nisl venenatis lacinia aenean sit amet justo morbi ut odio cras mi pede malesuada in imperdiet et commodo vulputate justo
322,5/13/2022,6456.05,withdrawal,Dabshots,utilities,credit card,Tianzhu,CNY,dolor sit amet consectetuer adipiscing elit proin interdum mauris non ligula pellentesque ultrices phasellus id sapien in sapien iaculis congue
323,5/26/2022,8854.42,deposit,Feednation,entertainment,checking,El Rosario,USD,amet diam in magna bibendum imperdiet nullam orci pede venenatis non
324,5/8/2022,7339.15,transfer,Katz,transportation,savings,Yanda Bayo,NGN,ante ipsum primis in faucibus orci luctus et ultrices posuere cubilia curae nulla dapibus dolor vel est donec odio
325,5/23/2022,7292.66,withdrawal,Midel,groceries,savings,Sabanalarga,COP,vivamus metus arcu adipiscing molestie hendrerit at vulputate vitae nisl aenean lectus pellentesque eget nunc donec
326,5/8/2022,7443.34,deposit,Skiba,transportation,savings,Xianxi,CNY,lectus vestibulum quam sapien varius ut blandit non interdum in ante
327,5/20/2022,9753.86,deposit,Buzzster,groceries,credit card,Alexandria,USD,congue elementum in hac habitasse platea dictumst morbi vestibulum velit
328,5/27/2022,1809.63,withdrawal,Gabvine,utilities,savings,Quintães,EUR,id sapien in sapien iaculis congue vivamus metus arcu adipiscing molestie hendrerit
329,5/18/2022,6500.58,transfer,Avaveo,utilities,checking,Pärnu,EUR,convallis tortor risus dapibus augue vel accumsan tellus nisi eu orci mauris lacinia sapien quis libero nullam sit
330,5/8/2022,6563.72,withdrawal,Rooxo,entertainment,credit card,Dongping,CNY,nec dui luctus rutrum nulla tellus in sagittis dui vel nisl duis ac nibh fusce lacus purus aliquet at feugiat
331,5/4/2022,4198.34,transfer,Fivespan,utilities,checking,Jiangyi,CNY,felis fusce posuere felis sed lacus morbi sem mauris laoreet ut rhoncus aliquet pulvinar
332,5/8/2022,223.95,transfer,Edgeify,utilities,checking,Enskede,SEK,vestibulum sit amet cursus id turpis integer aliquet massa id lobortis convallis tortor risus dapibus augue
333,5/15/2022,6608.43,withdrawal,Linktype,transportation,credit card,Cañasgordas,COP,at turpis donec posuere metus vitae ipsum aliquam non mauris morbi non lectus aliquam sit amet diam
334,5/12/2022,294.3,withdrawal,Tagchat,groceries,checking,Bulu,IDR,nisi at nibh in hac habitasse platea dictumst aliquam augue quam sollicitudin vitae consectetuer eget
335,5/20/2022,9397.89,transfer,Dynazzy,utilities,credit card,Jombang,IDR,augue a suscipit nulla elit ac nulla sed vel enim sit
336,5/21/2022,1509.53,deposit,Fivechat,utilities,credit card,Yangwei,CNY,tincidunt ante vel ipsum praesent blandit lacinia erat vestibulum sed magna at nunc commodo placerat praesent
337,5/25/2022,7365.59,deposit,Zooveo,transportation,savings,Wujingfu,CNY,consectetuer adipiscing elit proin risus praesent lectus vestibulum quam sapien varius ut blandit non interdum in ante vestibulum
338,5/14/2022,1106.27,transfer,Jayo,utilities,savings,Liulin,CNY,id ornare imperdiet sapien urna pretium nisl ut volutpat sapien arcu sed augue aliquam erat volutpat in
339,5/19/2022,8829.52,deposit,Reallinks,entertainment,checking,Sempu,IDR,nascetur ridiculus mus vivamus vestibulum sagittis sapien cum sociis natoque penatibus et magnis dis parturient montes nascetur ridiculus
340,5/13/2022,4278.33,deposit,Oyoloo,utilities,credit card,Santo Antônio da Platina,BRL,in lectus pellentesque at nulla suspendisse potenti cras in purus eu magna vulputate luctus cum sociis natoque
341,5/2/2022,3773.86,transfer,Ailane,transportation,credit card,Ḩabūr,YER,mus vivamus vestibulum sagittis sapien cum sociis natoque penatibus et magnis dis parturient montes
342,5/14/2022,8650.28,withdrawal,Katz,utilities,credit card,Starychi,UAH,in ante vestibulum ante ipsum primis in faucibus orci luctus et ultrices posuere cubilia curae duis faucibus
343,5/18/2022,3875.83,withdrawal,Latz,entertainment,checking,Majie,CNY,mi integer ac neque duis bibendum morbi non quam nec dui luctus rutrum
344,5/13/2022,4705.86,withdrawal,Nlounge,entertainment,credit card,Hechun,CNY,blandit non interdum in ante vestibulum ante ipsum primis in faucibus orci luctus et ultrices posuere cubilia curae duis faucibus
345,5/23/2022,5949.49,transfer,Abata,transportation,checking,Basīrpur,PKR,nulla eget eros elementum pellentesque quisque porta volutpat erat quisque
346,5/14/2022,8708.76,deposit,Twitterbeat,entertainment,credit card,Chenfang,CNY,praesent blandit nam nulla integer pede justo lacinia eget tincidunt eget tempus
347,5/30/2022,814.31,withdrawal,Twitterbridge,transportation,savings,Sionogan,PHP,lobortis est phasellus sit amet erat nulla tempus vivamus in felis eu sapien cursus vestibulum proin eu
348,5/22/2022,4943.94,withdrawal,Oyoloo,groceries,checking,Krajan Selatan,IDR,eu massa donec dapibus duis at velit eu est congue elementum in hac habitasse platea
349,5/8/2022,745.12,withdrawal,Edgepulse,entertainment,checking,Fulu,CNY,ipsum praesent blandit lacinia erat vestibulum sed magna at nunc commodo placerat praesent blandit nam nulla integer pede
350,5/1/2022,2168.72,withdrawal,Divape,transportation,savings,Heshang,CNY,ultrices mattis odio donec vitae nisi nam ultrices libero non mattis
351,5/23/2022,9613.63,transfer,Mynte,transportation,savings,Halayhay,PHP,diam id ornare imperdiet sapien urna pretium nisl ut volutpat sapien arcu sed augue aliquam erat
352,5/16/2022,8027.38,transfer,Eadel,utilities,credit card,Manquiring,PHP,amet nulla quisque arcu libero rutrum ac lobortis vel dapibus at diam nam tristique
353,5/4/2022,2276.01,withdrawal,Meemm,transportation,checking,Bago,MMK,eget orci vehicula condimentum curabitur in libero ut massa volutpat convallis morbi odio odio elementum eu interdum eu tincidunt
354,5/15/2022,1357.98,transfer,Eazzy,transportation,credit card,Dingjiayao,CNY,sagittis sapien cum sociis natoque penatibus et magnis dis parturient
355,5/19/2022,1542.42,withdrawal,Kaymbo,entertainment,checking,Miguel Hidalgo,MXN,rutrum rutrum neque aenean auctor gravida sem praesent id massa id nisl venenatis lacinia aenean sit amet justo
356,5/1/2022,2570.9,transfer,Miboo,utilities,savings,Prince Rupert,CAD,aenean lectus pellentesque eget nunc donec quis orci eget orci vehicula condimentum curabitur in libero ut
357,5/27/2022,2674.09,transfer,Twitternation,transportation,checking,Wenquan,CNY,quis odio consequat varius integer ac leo pellentesque ultrices mattis odio donec
358,5/11/2022,8239.42,transfer,Zava,entertainment,checking,Amsterdam Oud Zuid en Rivierenbuurt,EUR,vitae nisl aenean lectus pellentesque eget nunc donec quis orci eget orci vehicula
359,5/6/2022,5903.73,withdrawal,Skippad,transportation,credit card,Beverwijk,EUR,id justo sit amet sapien dignissim vestibulum vestibulum ante ipsum
360,5/20/2022,8148.48,transfer,Leenti,groceries,credit card,Curiapo,VEF,nec sem duis aliquam convallis nunc proin at turpis a pede posuere nonummy
361,5/11/2022,9914.94,transfer,Skilith,entertainment,credit card,Presidente Médici,BRL,blandit nam nulla integer pede justo lacinia eget tincidunt eget tempus vel pede morbi porttitor lorem id ligula suspendisse
362,5/29/2022,4437.57,transfer,Thoughtmix,entertainment,checking,Dongjin,CNY,semper est quam pharetra magna ac consequat metus sapien ut nunc vestibulum ante ipsum primis in faucibus orci
363,5/12/2022,1684.0,transfer,Jaloo,entertainment,checking,Tukums,EUR,morbi porttitor lorem id ligula suspendisse ornare consequat lectus in est risus auctor sed tristique in tempus sit amet sem
364,5/28/2022,1326.77,transfer,Twitterlist,groceries,checking,Nový Bydžov,CZK,rhoncus dui vel sem sed sagittis nam congue risus semper porta volutpat quam pede lobortis ligula
365,5/5/2022,183.41,transfer,Eire,groceries,checking,Nueve de Julio,ARS,posuere felis sed lacus morbi sem mauris laoreet ut rhoncus aliquet pulvinar sed nisl nunc rhoncus dui vel sem
366,5/15/2022,6106.53,deposit,Riffwire,entertainment,savings,Zhongnan,CNY,nam dui proin leo odio porttitor id consequat in consequat ut
367,5/20/2022,4482.4,deposit,Rhycero,utilities,checking,Maseru,LSL,at ipsum ac tellus semper interdum mauris ullamcorper purus sit amet nulla quisque arcu libero rutrum
368,5/22/2022,1615.18,withdrawal,Demizz,transportation,credit card,Wakema,MMK,magna at nunc commodo placerat praesent blandit nam nulla integer pede justo lacinia eget tincidunt eget tempus vel
369,5/26/2022,6795.33,transfer,Demizz,transportation,credit card,Panambi,BRL,ut at dolor quis odio consequat varius integer ac leo pellentesque ultrices mattis odio donec vitae
370,5/10/2022,9643.71,withdrawal,Tagpad,groceries,checking,Wiesbaden,EUR,tortor quis turpis sed ante vivamus tortor duis mattis egestas metus
371,5/3/2022,5085.67,deposit,Jaxspan,transportation,savings,Greensboro,USD,volutpat sapien arcu sed augue aliquam erat volutpat in congue etiam justo etiam pretium iaculis justo in
372,5/12/2022,8230.41,deposit,Jabbertype,groceries,savings,Huzhou,CNY,mattis odio donec vitae nisi nam ultrices libero non mattis pulvinar
373,5/10/2022,9264.98,withdrawal,Flashset,entertainment,savings,Al Qubbah,LYD,lobortis sapien sapien non mi integer ac neque duis bibendum morbi non
374,5/16/2022,1678.84,deposit,Roombo,transportation,savings,Bulod,PHP,in leo maecenas pulvinar lobortis est phasellus sit amet erat nulla tempus vivamus in felis eu sapien cursus vestibulum
375,5/11/2022,7652.7,deposit,Yodoo,transportation,savings,Fezna,MAD,duis mattis egestas metus aenean fermentum donec ut mauris eget massa tempor convallis nulla neque libero convallis eget eleifend
376,5/20/2022,901.73,deposit,Tazzy,entertainment,checking,Ayapel,COP,blandit lacinia erat vestibulum sed magna at nunc commodo placerat praesent blandit
377,5/27/2022,2054.34,transfer,Meezzy,utilities,checking,Bangonay,PHP,pellentesque ultrices phasellus id sapien in sapien iaculis congue vivamus metus arcu adipiscing
378,5/18/2022,9305.66,withdrawal,Rhycero,entertainment,credit card,Iwŏn-ŭp,KPW,venenatis tristique fusce congue diam id ornare imperdiet sapien urna pretium nisl ut volutpat sapien
379,5/9/2022,9913.77,withdrawal,Tanoodle,entertainment,credit card,Haliut,CNY,ullamcorper augue a suscipit nulla elit ac nulla sed vel enim sit amet nunc viverra dapibus nulla
380,5/19/2022,3317.97,withdrawal,Eidel,entertainment,savings,Amparafaravola,MGA,sed augue aliquam erat volutpat in congue etiam justo etiam pretium
381,5/25/2022,1612.72,transfer,Riffpath,utilities,checking,Sofiyivka,UAH,tellus semper interdum mauris ullamcorper purus sit amet nulla quisque arcu libero rutrum ac lobortis vel dapibus at diam
382,5/4/2022,7596.81,deposit,Yambee,transportation,checking,Pudasjärvi,EUR,habitasse platea dictumst maecenas ut massa quis augue luctus tincidunt nulla mollis molestie lorem quisque ut erat curabitur gravida
383,5/12/2022,759.87,transfer,Oyondu,transportation,savings,Hampton,USD,diam erat fermentum justo nec condimentum neque sapien placerat ante nulla justo aliquam quis turpis eget elit sodales
384,5/8/2022,9074.57,withdrawal,Jayo,groceries,credit card,Chak,PKR,neque libero convallis eget eleifend luctus ultricies eu nibh quisque id justo sit amet sapien dignissim
385,5/27/2022,7989.14,withdrawal,Edgetag,utilities,checking,Linmansangan,PHP,blandit lacinia erat vestibulum sed magna at nunc commodo placerat praesent
386,5/29/2022,9734.38,deposit,Quamba,entertainment,credit card,Huichang,CNY,ut dolor morbi vel lectus in quam fringilla rhoncus mauris
387,5/19/2022,4582.0,transfer,Meembee,entertainment,savings,Novyy Svit,UAH,adipiscing lorem vitae mattis nibh ligula nec sem duis aliquam convallis nunc proin at
388,5/5/2022,7343.81,deposit,Realcube,groceries,checking,Verkhnyaya Tura,RUB,vitae quam suspendisse potenti nullam porttitor lacus at turpis donec posuere metus vitae ipsum aliquam non mauris morbi non
389,5/5/2022,3660.54,withdrawal,Bluezoom,entertainment,credit card,Ban Lam Luk Ka,THB,accumsan tortor quis turpis sed ante vivamus tortor duis mattis egestas
390,5/1/2022,6846.77,transfer,Snaptags,utilities,credit card,Daba,CNY,id ligula suspendisse ornare consequat lectus in est risus auctor
391,5/22/2022,6186.23,transfer,Thoughtbeat,utilities,savings,Birmingham,GBP,in tempus sit amet sem fusce consequat nulla nisl nunc nisl duis bibendum felis sed interdum venenatis turpis
392,5/7/2022,4275.73,deposit,Livepath,utilities,credit card,Senggreng,IDR,curae duis faucibus accumsan odio curabitur convallis duis consequat dui
393,5/21/2022,6152.75,transfer,Edgewire,transportation,checking,Āl Ma‘ūdah,YER,erat nulla tempus vivamus in felis eu sapien cursus vestibulum proin eu mi nulla ac enim in
394,5/20/2022,8536.84,deposit,Yakidoo,groceries,checking,Bengga,IDR,et ultrices posuere cubilia curae nulla dapibus dolor vel est donec odio justo
395,5/24/2022,9812.62,deposit,Tavu,utilities,credit card,Vavatenina,MGA,at nibh in hac habitasse platea dictumst aliquam augue quam sollicitudin vitae
396,5/17/2022,5158.88,withdrawal,Twitterwire,groceries,savings,Sandgerði,ISK,justo eu massa donec dapibus duis at velit eu est congue elementum in hac habitasse
397,5/28/2022,5159.76,transfer,Photojam,groceries,savings,Yangsan,KRW,erat tortor sollicitudin mi sit amet lobortis sapien sapien non mi integer ac neque
398,5/2/2022,283.4,transfer,JumpXS,utilities,checking,Newlands,ZAR,curae duis faucibus accumsan odio curabitur convallis duis consequat dui nec nisi volutpat eleifend donec ut dolor morbi vel lectus
399,5/6/2022,2829.52,transfer,Innojam,groceries,credit card,Lipie,PLN,tempus vel pede morbi porttitor lorem id ligula suspendisse ornare consequat
400,5/23/2022,3023.37,deposit,Buzzster,utilities,checking,Bandeirantes,BRL,odio porttitor id consequat in consequat ut nulla sed accumsan felis ut at dolor quis odio
401,5/23/2022,3833.85,withdrawal,Rhyloo,groceries,credit card,Qorao’zak,UZS,quis libero nullam sit amet turpis elementum ligula vehicula consequat morbi a ipsum
402,5/4/2022,2979.09,withdrawal,Photobug,transportation,savings,Sui’an,CNY,vivamus vel nulla eget eros elementum pellentesque quisque porta volutpat erat quisque erat eros viverra eget congue
403,5/6/2022,2644.11,deposit,Abata,groceries,credit card,San Agustín,USD,vitae nisl aenean lectus pellentesque eget nunc donec quis orci eget orci vehicula condimentum curabitur in
404,5/29/2022,2906.62,deposit,Dablist,groceries,checking,Zachepylivka,UAH,vel sem sed sagittis nam congue risus semper porta volutpat quam pede lobortis ligula sit
405,5/18/2022,5534.74,transfer,Oyonder,utilities,savings,Kolno,PLN,dui maecenas tristique est et tempus semper est quam pharetra magna ac consequat metus sapien ut nunc vestibulum ante
406,5/20/2022,2658.35,withdrawal,Fiveclub,groceries,credit card,Bailizhou,CNY,curae donec pharetra magna vestibulum aliquet ultrices erat tortor sollicitudin mi sit amet lobortis sapien sapien non mi integer
407,5/21/2022,3656.47,transfer,Babbleset,utilities,checking,Suncun,CNY,justo maecenas rhoncus aliquam lacus morbi quis tortor id nulla ultrices aliquet
408,5/13/2022,1399.01,transfer,Skidoo,entertainment,credit card,Zubtsov,RUB,lectus in est risus auctor sed tristique in tempus sit amet sem fusce consequat nulla nisl nunc nisl
409,5/27/2022,6655.84,transfer,Tazz,entertainment,checking,Zakan-Yurt,RUB,blandit ultrices enim lorem ipsum dolor sit amet consectetuer adipiscing elit proin interdum mauris non
410,5/30/2022,4375.39,transfer,Wordpedia,entertainment,savings,Agen,EUR,vestibulum ante ipsum primis in faucibus orci luctus et ultrices posuere cubilia curae mauris viverra diam vitae quam suspendisse
411,5/12/2022,5779.02,withdrawal,Twitterwire,transportation,savings,Yongchuan,CNY,diam erat fermentum justo nec condimentum neque sapien placerat ante nulla justo aliquam quis turpis eget elit sodales
412,5/3/2022,5180.51,transfer,Jaxbean,utilities,checking,Hassi Berkane,MAD,vulputate ut ultrices vel augue vestibulum ante ipsum primis in faucibus orci luctus et ultrices posuere cubilia curae donec pharetra
413,5/15/2022,5686.77,deposit,Realfire,utilities,checking,Sanquan,CNY,turpis elementum ligula vehicula consequat morbi a ipsum integer a nibh in quis justo maecenas rhoncus aliquam lacus morbi quis
414,5/20/2022,6784.07,withdrawal,Thoughtbeat,transportation,savings,Bicas,EUR,natoque penatibus et magnis dis parturient montes nascetur ridiculus mus etiam vel augue
415,5/26/2022,2812.6,transfer,Trudeo,groceries,savings,Korets’,UAH,cubilia curae duis faucibus accumsan odio curabitur convallis duis consequat dui nec nisi volutpat eleifend
416,5/13/2022,7540.15,withdrawal,Vidoo,entertainment,credit card,Sankui,CNY,lacus at turpis donec posuere metus vitae ipsum aliquam non mauris morbi non lectus aliquam sit amet diam in magna
417,5/15/2022,2435.07,deposit,Roodel,transportation,savings,Zheleznovodsk,RUB,enim leo rhoncus sed vestibulum sit amet cursus id turpis integer aliquet massa id lobortis convallis
418,5/14/2022,1347.67,deposit,Thoughtblab,entertainment,credit card,Wadusari,IDR,rutrum nulla nunc purus phasellus in felis donec semper sapien a libero nam dui proin leo odio
419,5/29/2022,3760.1,deposit,Oloo,entertainment,checking,Moss,NOK,quis justo maecenas rhoncus aliquam lacus morbi quis tortor id nulla ultrices aliquet maecenas
420,5/13/2022,4373.8,withdrawal,Vinder,entertainment,checking,Gedaliang,CNY,ut ultrices vel augue vestibulum ante ipsum primis in faucibus orci
421,5/4/2022,9356.43,withdrawal,Devify,transportation,checking,Bački Petrovac,RSD,duis bibendum felis sed interdum venenatis turpis enim blandit mi in
422,5/17/2022,6672.19,deposit,Roomm,utilities,savings,Mufushan,CNY,non velit donec diam neque vestibulum eget vulputate ut ultrices vel augue
423,5/2/2022,4335.07,deposit,Browsebug,utilities,savings,Volochys’k,UAH,mi integer ac neque duis bibendum morbi non quam nec dui luctus rutrum nulla tellus in sagittis dui vel
424,5/30/2022,7677.15,withdrawal,Flipstorm,groceries,credit card,Suqiaoxiang,CNY,luctus et ultrices posuere cubilia curae nulla dapibus dolor vel est
425,5/20/2022,6159.4,withdrawal,Skidoo,groceries,credit card,Nunmanu,IDR,erat tortor sollicitudin mi sit amet lobortis sapien sapien non mi integer
426,5/26/2022,7802.5,deposit,Jetwire,transportation,checking,Kohāt,PKR,donec quis orci eget orci vehicula condimentum curabitur in libero
427,5/26/2022,6869.32,withdrawal,Vidoo,entertainment,checking,Bukuru,NGN,id nisl venenatis lacinia aenean sit amet justo morbi ut odio cras mi pede malesuada in imperdiet et commodo vulputate
428,5/15/2022,9544.16,deposit,Twitterbridge,entertainment,savings,Bacungan,PHP,auctor gravida sem praesent id massa id nisl venenatis lacinia aenean sit amet justo morbi
429,5/18/2022,8578.25,deposit,Flashpoint,groceries,checking,Wukang,CNY,faucibus cursus urna ut tellus nulla ut erat id mauris vulputate elementum nullam varius nulla facilisi cras non velit nec
430,5/16/2022,2806.41,withdrawal,Zoovu,entertainment,credit card,Keruguya,KES,phasellus in felis donec semper sapien a libero nam dui proin leo
431,5/20/2022,7351.67,deposit,Topicblab,groceries,checking,Bratsk,RUB,sapien cum sociis natoque penatibus et magnis dis parturient montes nascetur ridiculus mus etiam vel augue vestibulum rutrum rutrum
432,5/24/2022,8440.21,transfer,Izio,entertainment,credit card,Fagatogo,USD,aenean fermentum donec ut mauris eget massa tempor convallis nulla neque libero convallis eget eleifend luctus ultricies eu nibh quisque
433,5/22/2022,8565.56,deposit,Youspan,entertainment,checking,Mahaddayweyne,SOS,dui nec nisi volutpat eleifend donec ut dolor morbi vel lectus in quam fringilla rhoncus
434,5/23/2022,8429.63,withdrawal,Tagcat,groceries,credit card,Quintães,EUR,posuere felis sed lacus morbi sem mauris laoreet ut rhoncus aliquet pulvinar sed nisl nunc rhoncus
435,5/6/2022,329.33,transfer,Wikivu,transportation,credit card,Bulacan,PHP,ultrices mattis odio donec vitae nisi nam ultrices libero non mattis pulvinar nulla pede ullamcorper augue a suscipit
436,5/25/2022,5465.58,deposit,Oyondu,transportation,credit card,Santo Estêvão,BRL,id lobortis convallis tortor risus dapibus augue vel accumsan tellus nisi eu orci mauris lacinia
437,5/6/2022,4583.64,transfer,Dynazzy,groceries,credit card,Tubli,PHP,donec ut dolor morbi vel lectus in quam fringilla rhoncus mauris enim leo rhoncus sed
438,5/14/2022,510.19,deposit,Zoomlounge,transportation,checking,Lokolande,IDR,integer aliquet massa id lobortis convallis tortor risus dapibus augue vel accumsan tellus nisi eu
439,5/6/2022,1677.59,withdrawal,Rhyloo,groceries,checking,Ancenis,EUR,semper rutrum nulla nunc purus phasellus in felis donec semper sapien a libero nam
440,5/11/2022,749.92,withdrawal,Bubbletube,transportation,savings,Kirkland,CAD,neque vestibulum eget vulputate ut ultrices vel augue vestibulum ante ipsum
441,5/24/2022,3970.56,withdrawal,Camimbo,groceries,credit card,Santa Iria de Azóia,EUR,vestibulum vestibulum ante ipsum primis in faucibus orci luctus et ultrices posuere cubilia curae nulla dapibus dolor vel est donec
442,5/3/2022,4021.6,transfer,Voonix,transportation,credit card,Pesek,IDR,pede libero quis orci nullam molestie nibh in lectus pellentesque at nulla
443,5/17/2022,5464.06,transfer,Dablist,utilities,credit card,Jincheng,TWD,turpis sed ante vivamus tortor duis mattis egestas metus aenean fermentum donec
444,5/24/2022,3560.88,withdrawal,Browseblab,entertainment,checking,Washington,USD,sit amet justo morbi ut odio cras mi pede malesuada in imperdiet
445,5/10/2022,9465.08,transfer,Cogilith,transportation,checking,Takahama,JPY,habitasse platea dictumst maecenas ut massa quis augue luctus tincidunt nulla mollis molestie lorem quisque ut erat curabitur gravida
446,5/6/2022,1478.56,withdrawal,Kazio,utilities,checking,Kaa-Khem,RUB,turpis elementum ligula vehicula consequat morbi a ipsum integer a nibh in quis justo maecenas
447,5/30/2022,2050.94,withdrawal,Skimia,transportation,checking,Hailang,CNY,condimentum neque sapien placerat ante nulla justo aliquam quis turpis eget elit sodales scelerisque mauris sit
448,5/17/2022,9223.26,deposit,Agimba,transportation,checking,Luxia,CNY,ante ipsum primis in faucibus orci luctus et ultrices posuere cubilia curae mauris viverra diam vitae
449,5/4/2022,6440.26,deposit,Topicblab,entertainment,checking,San Antonio,MXN,id turpis integer aliquet massa id lobortis convallis tortor risus dapibus
450,5/21/2022,1580.46,deposit,Devpulse,groceries,credit card,Vlissingen,EUR,sed justo pellentesque viverra pede ac diam cras pellentesque volutpat dui
451,5/8/2022,5102.99,deposit,Midel,entertainment,credit card,Gandara,PHP,varius nulla facilisi cras non velit nec nisi vulputate nonummy maecenas tincidunt lacus at velit vivamus vel
